{
  "id": "la_rochelle",
  "name": "La Rochelle",
  "date": "1372-06-23",
  "place_name": "Devant La Rochelle, dans le pertuis d'Antioche",
  "sea_zone": "sea_bay_of_biscay",
  "season": "summer",
  "wind_to_deg": 5.0,
  "wind_strength": 0.45,
  "shore": true,
  "player_side": "attacker",
  "description": "Le comte de Pembroke vient prendre le commandement en Aquitaine avec l'argent de la solde. Devant La Rochelle, les douze galères castillanes d'Ambrosio Boccanegra, alliées de Charles V, l'attendent. À marée basse, les hautes cogues anglaises s'échouent sur les vasières tandis que les galères, qui calent peu, tournent autour d'elles : flèches enflammées, huile, le feu fait le reste. Pembroke est pris, la flotte anglaise détruite, et la mer de Gascogne passe aux alliés du roi de France.",
  "attacker": {
    "faction": "fac_castile",
    "faction_name": "Castille",
    "admiral": "Ambrosio Boccanegra",
    "units": [
      { "unit_type": "unit_crossbowmen", "name": "Ballesteros de Séville", "morale": 75 },
      { "unit_type": "unit_men_at_arms_foot", "name": "Hommes d'armes castillans", "morale": 75 }
    ],
    "ships": [
      { "name": "la galère de Boccanegra", "class": "ship_galley", "flagship": true, "fire_arrows": true, "crew": [ { "unit": 0, "men": 30 }, { "unit": 1, "men": 20 } ] },
      { "name": "la Santa María", "class": "ship_galley", "fire_arrows": true, "crew": [ { "unit": 0, "men": 30 }, { "unit": 1, "men": 20 } ] },
      { "name": "la San Juan", "class": "ship_galley", "fire_arrows": true, "crew": [ { "unit": 0, "men": 30 }, { "unit": 1, "men": 20 } ] },
      { "name": "la Santiago", "class": "ship_galley", "fire_arrows": true, "crew": [ { "unit": 0, "men": 30 }, { "unit": 1, "men": 20 } ] },
      { "name": "la San Pedro", "class": "ship_galley", "fire_arrows": true, "crew": [ { "unit": 0, "men": 30 }, { "unit": 1, "men": 20 } ] },
      { "name": "la Santa Catalina", "class": "ship_galley", "fire_arrows": true, "crew": [ { "unit": 0, "men": 30 }, { "unit": 1, "men": 20 } ] },
      { "name": "la San Nicolás", "class": "ship_galley", "fire_arrows": true, "crew": [ { "unit": 0, "men": 30 }, { "unit": 1, "men": 20 } ] },
      { "name": "la San Salvador", "class": "ship_galley", "fire_arrows": true, "crew": [ { "unit": 0, "men": 30 }, { "unit": 1, "men": 20 } ] },
      { "name": "la Santa Clara", "class": "ship_galley", "fire_arrows": true, "crew": [ { "unit": 0, "men": 30 }, { "unit": 1, "men": 20 } ] },
      { "name": "la San Andrés", "class": "ship_galley", "fire_arrows": true, "crew": [ { "unit": 0, "men": 30 }, { "unit": 1, "men": 20 } ] },
      { "name": "la Santa Cruz", "class": "ship_galley", "fire_arrows": true, "crew": [ { "unit": 0, "men": 30 }, { "unit": 1, "men": 20 } ] },
      { "name": "la San Jorge", "class": "ship_galley", "fire_arrows": true, "crew": [ { "unit": 0, "men": 30 }, { "unit": 1, "men": 20 } ] },
      { "name": "un brûlot", "class": "ship_barge", "fireship": true, "crew": [ { "unit": 1, "men": 4 } ] },
      { "name": "un autre brûlot", "class": "ship_barge", "fireship": true, "crew": [ { "unit": 1, "men": 4 } ] }
    ]
  },
  "defender": {
    "faction": "fac_england",
    "faction_name": "Angleterre",
    "admiral": "John Hastings, comte de Pembroke",
    "hold": true,
    "units": [
      { "unit_type": "unit_english_retinue", "name": "Retenue de Pembroke", "morale": 70 },
      { "unit_type": "unit_longbowmen", "name": "Archers de Pembroke", "morale": 65 }
    ],
    "ships": [
      { "name": "la Sainte-Marie de la Tour", "class": "ship_nef", "flagship": true, "position": [280.0, 0.0], "heading_deg": 180.0, "crew": [ { "unit": 0, "men": 50 }, { "unit": 1, "men": 30 } ] },
      { "name": "la Sainte-Marie de Southampton", "class": "ship_cog", "position": [260.0, -60.0], "heading_deg": 190.0, "crew": [ { "unit": 0, "men": 20 }, { "unit": 1, "men": 25 } ] },
      { "name": "la Trinité de Fowey", "class": "ship_cog", "position": [265.0, 60.0], "heading_deg": 170.0, "crew": [ { "unit": 0, "men": 20 }, { "unit": 1, "men": 25 } ] },
      { "name": "la Christophe de Poole", "class": "ship_cog", "position": [320.0, -110.0], "heading_deg": 185.0, "crew": [ { "unit": 0, "men": 15 }, { "unit": 1, "men": 25 } ] },
      { "name": "la Katherine de Plymouth", "class": "ship_cog", "position": [325.0, 110.0], "heading_deg": 175.0, "crew": [ { "unit": 0, "men": 15 }, { "unit": 1, "men": 25 } ] },
      { "name": "la Nicolas de Dartmouth", "class": "ship_cog", "position": [340.0, -30.0], "heading_deg": 180.0, "crew": [ { "unit": 0, "men": 15 }, { "unit": 1, "men": 20 } ] },
      { "name": "la Marie de Bristol", "class": "ship_cog", "position": [345.0, 35.0], "heading_deg": 180.0, "crew": [ { "unit": 0, "men": 15 }, { "unit": 1, "men": 20 } ] },
      { "name": "la Margarete de Lynn", "class": "ship_cog", "position": [390.0, -80.0], "heading_deg": 180.0, "crew": [ { "unit": 0, "men": 10 }, { "unit": 1, "men": 20 } ] },
      { "name": "la Jonette de Weymouth", "class": "ship_barge", "position": [395.0, 80.0], "heading_deg": 180.0, "crew": [ { "unit": 0, "men": 10 }, { "unit": 1, "men": 15 } ] },
      { "name": "le Saint-Georges", "class": "ship_barge", "position": [410.0, 0.0], "heading_deg": 180.0, "crew": [ { "unit": 0, "men": 10 }, { "unit": 1, "men": 15 } ] }
    ]
  },
  "sources": ["Bataille de La Rochelle (1372)", "Froissart, Chroniques, I", "Jonathan Sumption, The Hundred Years War III: Divided Houses"]
}
